{
  "user": "yohannvp",
  "generatedAt": "2025-10-10T16:48:41.232Z",
  "totals": {
    "solved": 38,
    "easy": 9,
    "medium": 7,
    "hard": 3
  },
  "streakDays": 0,
  "weekly": [
    {
      "week": "2025-W27",
      "count": 23
    },
    {
      "week": "2025-W28",
      "count": 4
    },
    {
      "week": "2025-W29",
      "count": 1
    }
  ],
  "recent": [
    {
      "id": "meeting-rooms-iii",
      "title": "Meeting Rooms III",
      "difficulty": "—",
      "language": "python3",
      "status": "Accepted",
      "url": "https://leetcode.com/problems/meeting-rooms-iii/"
    },
    {
      "id": "reschedule-meetings-for-maximum-free-time-i",
      "title": "Reschedule Meetings for Maximum Free Time I",
      "difficulty": "—",
      "language": "python3",
      "status": "Accepted",
      "url": "https://leetcode.com/problems/reschedule-meetings-for-maximum-free-time-i/"
    },
    {
      "id": "reschedule-meetings-for-maximum-free-time-ii",
      "title": "Reschedule Meetings for Maximum Free Time II",
      "difficulty": "—",
      "language": "python3",
      "status": "Accepted",
      "url": "https://leetcode.com/problems/reschedule-meetings-for-maximum-free-time-ii/"
    },
    {
      "id": "reschedule-meetings-for-maximum-free-time-i",
      "title": "Reschedule Meetings for Maximum Free Time I",
      "difficulty": "—",
      "language": "python3",
      "status": "Accepted",
      "url": "https://leetcode.com/problems/reschedule-meetings-for-maximum-free-time-i/"
    },
    {
      "id": "maximum-number-of-events-that-can-be-attended-ii",
      "title": "Maximum Number of Events That Can Be Attended II",
      "difficulty": "—",
      "language": "python",
      "status": "Accepted",
      "url": "https://leetcode.com/problems/maximum-number-of-events-that-can-be-attended-ii/"
    },
    {
      "id": "maximum-number-of-events-that-can-be-attended",
      "title": "Maximum Number of Events That Can Be Attended",
      "difficulty": "—",
      "language": "python3",
      "status": "Accepted",
      "url": "https://leetcode.com/problems/maximum-number-of-events-that-can-be-attended/"
    },
    {
      "id": "finding-pairs-with-a-certain-sum",
      "title": "Finding Pairs With a Certain Sum",
      "difficulty": "—",
      "language": "python3",
      "status": "Accepted",
      "url": "https://leetcode.com/problems/finding-pairs-with-a-certain-sum/"
    },
    {
      "id": "finding-pairs-with-a-certain-sum",
      "title": "Finding Pairs With a Certain Sum",
      "difficulty": "—",
      "language": "python3",
      "status": "Accepted",
      "url": "https://leetcode.com/problems/finding-pairs-with-a-certain-sum/"
    },
    {
      "id": "find-lucky-integer-in-an-array",
      "title": "Find Lucky Integer in an Array",
      "difficulty": "—",
      "language": "python3",
      "status": "Accepted",
      "url": "https://leetcode.com/problems/find-lucky-integer-in-an-array/"
    },
    {
      "id": "find-lucky-integer-in-an-array",
      "title": "Find Lucky Integer in an Array",
      "difficulty": "—",
      "language": "python3",
      "status": "Wrong Answer",
      "url": "https://leetcode.com/problems/find-lucky-integer-in-an-array/"
    },
    {
      "id": "find-lucky-integer-in-an-array",
      "title": "Find Lucky Integer in an Array",
      "difficulty": "—",
      "language": "python3",
      "status": "Wrong Answer",
      "url": "https://leetcode.com/problems/find-lucky-integer-in-an-array/"
    },
    {
      "id": "find-lucky-integer-in-an-array",
      "title": "Find Lucky Integer in an Array",
      "difficulty": "—",
      "language": "python3",
      "status": "Accepted",
      "url": "https://leetcode.com/problems/find-lucky-integer-in-an-array/"
    },
    {
      "id": "find-the-k-th-character-in-string-game-ii",
      "title": "Find the K-th Character in String Game II",
      "difficulty": "—",
      "language": "python3",
      "status": "Accepted",
      "url": "https://leetcode.com/problems/find-the-k-th-character-in-string-game-ii/"
    },
    {
      "id": "palindrome-number",
      "title": "Palindrome Number",
      "difficulty": "—",
      "language": "python3",
      "status": "Wrong Answer",
      "url": "https://leetcode.com/problems/palindrome-number/"
    },
    {
      "id": "palindrome-number",
      "title": "Palindrome Number",
      "difficulty": "—",
      "language": "python3",
      "status": "Accepted",
      "url": "https://leetcode.com/problems/palindrome-number/"
    },
    {
      "id": "palindrome-number",
      "title": "Palindrome Number",
      "difficulty": "—",
      "language": "python3",
      "status": "Accepted",
      "url": "https://leetcode.com/problems/palindrome-number/"
    },
    {
      "id": "palindrome-number",
      "title": "Palindrome Number",
      "difficulty": "—",
      "language": "python3",
      "status": "Accepted",
      "url": "https://leetcode.com/problems/palindrome-number/"
    },
    {
      "id": "palindrome-number",
      "title": "Palindrome Number",
      "difficulty": "—",
      "language": "python3",
      "status": "Accepted",
      "url": "https://leetcode.com/problems/palindrome-number/"
    },
    {
      "id": "palindrome-number",
      "title": "Palindrome Number",
      "difficulty": "—",
      "language": "python3",
      "status": "Accepted",
      "url": "https://leetcode.com/problems/palindrome-number/"
    },
    {
      "id": "palindrome-number",
      "title": "Palindrome Number",
      "difficulty": "—",
      "language": "python3",
      "status": "Wrong Answer",
      "url": "https://leetcode.com/problems/palindrome-number/"
    }
  ],
  "difficulty": [
    {
      "name": "Easy",
      "count": 9
    },
    {
      "name": "Medium",
      "count": 7
    },
    {
      "name": "Hard",
      "count": 3
    }
  ]
}
